{
  "name": "Hopscotch",
  "author": "Jan T. Sott",
  "authorUrl": "https://github.com/idleberg/Hopscotch.tmTheme",
  "version": "1.0.0",
  "description": "Retro-buntes Dark-Schema von Jan T. Sott, langjähriger Klassiker der iTerm2-Color-Schemes-Sammlung.",
  "variants": {
    "dark": {
      "mode": "dark",
      "label": "Dark",
      "colors": {
        "background": "#322931",
        "foreground": "#b9b5b8",
        "card": "#433b42",
        "card_foreground": "#b9b5b8",
        "popover": "#433b42",
        "popover_foreground": "#b9b5b8",
        "primary": "#1290bf",
        "primary_foreground": "#ffffff",
        "secondary": "#433b42",
        "secondary_foreground": "#b9b5b8",
        "muted": "#433b42",
        "muted_foreground": "#989498",
        "accent": "#c85e7c",
        "accent_foreground": "#ffffff",
        "destructive": "#dd464c",
        "destructive_foreground": "#ffffff",
        "border": "#483f47",
        "input": "#483f47",
        "ring": "#1290bf",
        "sidebar.background": "#2a2229",
        "toolbar.background": "#433b42",
        "title_bar.background": "#433b42",
        "status_bar.background": "#433b42",
        "border.variant": "#483f47",
        "border.focused": "#1290bf",
        "border.selected": "#1290bf",
        "border.transparent": "#00000000",
        "border.disabled": "#3d343c",
        "modified": "#1290bf",
        "error": "#dd464c",
        "warning": "#fdcc59",
        "info": "#1290bf",
        "hint": "#989498",
        "success": "#8fc13e",
        "cursor": "#1290bf",
        "selection": "#1290bf20",
        "terminal.background": "#322931",
        "terminal.foreground": "#b9b5b8",
        "terminal.bright_foreground": "#ffffff",
        "terminal.dim_foreground": "#989498",
        "terminal.ansi.background": "#322931",
        "terminal.ansi.black": "#433b42",
        "terminal.ansi.red": "#dd464c",
        "terminal.ansi.green": "#8fc13e",
        "terminal.ansi.yellow": "#fdcc59",
        "terminal.ansi.blue": "#1290bf",
        "terminal.ansi.magenta": "#c85e7c",
        "terminal.ansi.cyan": "#149b93",
        "terminal.ansi.white": "#b9b5b8",
        "terminal.ansi.bright_black": "#797379",
        "terminal.ansi.bright_red": "#e88286",
        "terminal.ansi.bright_green": "#aed274",
        "terminal.ansi.bright_yellow": "#fee2a0",
        "terminal.ansi.bright_blue": "#2db8eb",
        "terminal.ansi.bright_magenta": "#da93a7",
        "terminal.ansi.bright_cyan": "#1cdacf",
        "terminal.ansi.bright_white": "#ffffff",
        "terminal.ansi.dim_black": "#282327",
        "terminal.ansi.dim_red": "#a01d23",
        "terminal.ansi.dim_green": "#567425",
        "terminal.ansi.dim_yellow": "#eda703",
        "terminal.ansi.dim_blue": "#094a62",
        "terminal.ansi.dim_magenta": "#8f314c",
        "terminal.ansi.dim_cyan": "#08413d",
        "terminal.ansi.dim_white": "#9b969a",
        "sidebar-foreground": "#b9b5b8",
        "sidebar-primary": "#1290bf",
        "sidebar-primary-foreground": "#ffffff",
        "sidebar-accent": "#433b42",
        "sidebar-accent-foreground": "#b9b5b8",
        "sidebar-border": "#483f47",
        "sidebar-ring": "#1290bf"
      }
    },
    "light": {
      "mode": "light",
      "label": "Light",
      "colors": {
        "background": "#f5f1f4",
        "foreground": "#322931",
        "card": "#e8e1e6",
        "card_foreground": "#322931",
        "popover": "#e8e1e6",
        "popover_foreground": "#322931",
        "primary": "#0e749a",
        "primary_foreground": "#ffffff",
        "secondary": "#e8e1e6",
        "secondary_foreground": "#322931",
        "muted": "#e8e1e6",
        "muted_foreground": "#797379",
        "accent": "#bd4064",
        "accent_foreground": "#ffffff",
        "destructive": "#d3272e",
        "destructive_foreground": "#ffffff",
        "border": "#dad5d9",
        "input": "#dad5d9",
        "ring": "#0e749a",
        "sidebar.background": "#f1ebef",
        "toolbar.background": "#e8e1e6",
        "title_bar.background": "#e8e1e6",
        "status_bar.background": "#e8e1e6",
        "border.variant": "#dad5d9",
        "border.focused": "#0e749a",
        "border.selected": "#0e749a",
        "border.transparent": "#00000000",
        "border.disabled": "#e8e3e6",
        "modified": "#0e749a",
        "error": "#d3272e",
        "warning": "#fdc031",
        "info": "#0e749a",
        "hint": "#797379",
        "success": "#78a234",
        "cursor": "#0e749a",
        "selection": "#0e749a20",
        "terminal.background": "#f5f1f4",
        "terminal.foreground": "#322931",
        "terminal.bright_foreground": "#000000",
        "terminal.dim_foreground": "#797379",
        "terminal.ansi.background": "#f5f1f4",
        "terminal.ansi.black": "#322931",
        "terminal.ansi.red": "#d3272e",
        "terminal.ansi.green": "#78a234",
        "terminal.ansi.yellow": "#fdc031",
        "terminal.ansi.blue": "#0e749a",
        "terminal.ansi.magenta": "#bd4064",
        "terminal.ansi.cyan": "#0f7771",
        "terminal.ansi.white": "#797379",
        "terminal.ansi.bright_black": "#161216",
        "terminal.ansi.bright_red": "#e26065",
        "terminal.ansi.bright_green": "#9cc855",
        "terminal.ansi.bright_yellow": "#fed678",
        "terminal.ansi.bright_blue": "#14a5db",
        "terminal.ansi.bright_magenta": "#d0748f",
        "terminal.ansi.bright_cyan": "#17b6ad",
        "terminal.ansi.bright_white": "#000000",
        "terminal.ansi.dim_black": "#161216",
        "terminal.ansi.dim_red": "#7d171b",
        "terminal.ansi.dim_green": "#3f551b",
        "terminal.ansi.dim_yellow": "#c68b02",
        "terminal.ansi.dim_blue": "#062e3c",
        "terminal.ansi.dim_magenta": "#71263c",
        "terminal.ansi.dim_cyan": "#041c1b",
        "terminal.ansi.dim_white": "#979297",
        "sidebar-foreground": "#322931",
        "sidebar-primary": "#0e749a",
        "sidebar-primary-foreground": "#ffffff",
        "sidebar-accent": "#e8e1e6",
        "sidebar-accent-foreground": "#322931",
        "sidebar-border": "#dad5d9",
        "sidebar-ring": "#0e749a"
      }
    }
  }
}
