{
  "name": "Bluloco",
  "author": "Uloco",
  "authorUrl": "https://github.com/uloco/theme-bluloco-dark",
  "version": "1.0.0",
  "description": "Sehr lebendige, vivid Farbpalette von Uloco — häufig in Neovim-/Alacritty-Dotfiles zu finden.",
  "variants": {
    "dark": {
      "mode": "dark",
      "label": "Dark",
      "colors": {
        "background": "#282c34",
        "foreground": "#abb2bf",
        "card": "#22252a",
        "card_foreground": "#abb2bf",
        "popover": "#22252a",
        "popover_foreground": "#abb2bf",
        "primary": "#3375fe",
        "primary_foreground": "#ffffff",
        "secondary": "#22252a",
        "secondary_foreground": "#abb2bf",
        "muted": "#22252a",
        "muted_foreground": "#cdd3e0",
        "accent": "#9f7efe",
        "accent_foreground": "#ffffff",
        "destructive": "#fc2e51",
        "destructive_foreground": "#ffffff",
        "border": "#3d414a",
        "input": "#3d414a",
        "ring": "#3375fe",
        "sidebar.background": "#21252b",
        "toolbar.background": "#22252a",
        "title_bar.background": "#22252a",
        "status_bar.background": "#22252a",
        "border.variant": "#3d414a",
        "border.focused": "#3375fe",
        "border.selected": "#3375fe",
        "border.transparent": "#00000000",
        "border.disabled": "#32363f",
        "modified": "#3375fe",
        "error": "#fc2e51",
        "warning": "#ff9369",
        "info": "#3375fe",
        "hint": "#cdd3e0",
        "success": "#25a45c",
        "cursor": "#3375fe",
        "selection": "#3375fe20",
        "terminal.background": "#282c34",
        "terminal.foreground": "#abb2bf",
        "terminal.bright_foreground": "#ffffff",
        "terminal.dim_foreground": "#cdd3e0",
        "terminal.ansi.background": "#282c34",
        "terminal.ansi.black": "#42444d",
        "terminal.ansi.red": "#fc2e51",
        "terminal.ansi.green": "#25a45c",
        "terminal.ansi.yellow": "#ff9369",
        "terminal.ansi.blue": "#3375fe",
        "terminal.ansi.magenta": "#9f7efe",
        "terminal.ansi.cyan": "#4483aa",
        "terminal.ansi.white": "#cdd3e0",
        "terminal.ansi.bright_black": "#8f9aae",
        "terminal.ansi.bright_red": "#ff637f",
        "terminal.ansi.bright_green": "#3fc56a",
        "terminal.ansi.bright_yellow": "#f9c858",
        "terminal.ansi.bright_blue": "#10b0fe",
        "terminal.ansi.bright_magenta": "#ff78f8",
        "terminal.ansi.bright_cyan": "#5fb9bc",
        "terminal.ansi.bright_white": "#ffffff",
        "terminal.ansi.dim_black": "#2a2c32",
        "terminal.ansi.dim_red": "#c10323",
        "terminal.ansi.dim_green": "#12512d",
        "terminal.ansi.dim_yellow": "#ff4a03",
        "terminal.ansi.dim_blue": "#0142ca",
        "terminal.ansi.dim_magenta": "#5419fd",
        "terminal.ansi.dim_cyan": "#274b61",
        "terminal.ansi.dim_white": "#a7b2c9",
        "sidebar-foreground": "#abb2bf",
        "sidebar-primary": "#3375fe",
        "sidebar-primary-foreground": "#ffffff",
        "sidebar-accent": "#22252a",
        "sidebar-accent-foreground": "#abb2bf",
        "sidebar-border": "#3d414a",
        "sidebar-ring": "#3375fe"
      }
    },
    "light": {
      "mode": "light",
      "label": "Light",
      "colors": {
        "background": "#f9f9f9",
        "foreground": "#383a42",
        "card": "#e8e8e8",
        "card_foreground": "#383a42",
        "popover": "#e8e8e8",
        "popover_foreground": "#383a42",
        "primary": "#275fe4",
        "primary_foreground": "#ffffff",
        "secondary": "#e8e8e8",
        "secondary_foreground": "#383a42",
        "muted": "#e8e8e8",
        "muted_foreground": "#b9bac1",
        "accent": "#823ef0",
        "accent_foreground": "#ffffff",
        "destructive": "#d52652",
        "destructive_foreground": "#ffffff",
        "border": "#dededf",
        "input": "#dededf",
        "ring": "#275fe4",
        "sidebar.background": "#f4f4f4",
        "toolbar.background": "#e8e8e8",
        "title_bar.background": "#e8e8e8",
        "status_bar.background": "#e8e8e8",
        "border.variant": "#dededf",
        "border.focused": "#275fe4",
        "border.selected": "#275fe4",
        "border.transparent": "#00000000",
        "border.disabled": "#ececec",
        "modified": "#275fe4",
        "error": "#d52652",
        "warning": "#df621b",
        "info": "#275fe4",
        "hint": "#b9bac1",
        "success": "#239749",
        "cursor": "#275fe4",
        "selection": "#275fe420",
        "terminal.background": "#f9f9f9",
        "terminal.foreground": "#383a42",
        "terminal.bright_foreground": "#000000",
        "terminal.dim_foreground": "#b9bac1",
        "terminal.ansi.background": "#f9f9f9",
        "terminal.ansi.black": "#373a41",
        "terminal.ansi.red": "#d52652",
        "terminal.ansi.green": "#239749",
        "terminal.ansi.yellow": "#df621b",
        "terminal.ansi.blue": "#275fe4",
        "terminal.ansi.magenta": "#823ef0",
        "terminal.ansi.cyan": "#26608c",
        "terminal.ansi.white": "#b9bac1",
        "terminal.ansi.bright_black": "#676a77",
        "terminal.ansi.bright_red": "#ff637f",
        "terminal.ansi.bright_green": "#3cbc66",
        "terminal.ansi.bright_yellow": "#c5a231",
        "terminal.ansi.bright_blue": "#0099e0",
        "terminal.ansi.bright_magenta": "#ce32c0",
        "terminal.ansi.bright_cyan": "#6d92ba",
        "terminal.ansi.bright_white": "#d3d3d3",
        "terminal.ansi.dim_black": "#202125",
        "terminal.ansi.dim_red": "#7e1731",
        "terminal.ansi.dim_green": "#104421",
        "terminal.ansi.dim_yellow": "#843a10",
        "terminal.ansi.dim_blue": "#123893",
        "terminal.ansi.dim_magenta": "#500eba",
        "terminal.ansi.dim_cyan": "#10293c",
        "terminal.ansi.dim_white": "#d9dade",
        "sidebar-foreground": "#383a42",
        "sidebar-primary": "#275fe4",
        "sidebar-primary-foreground": "#ffffff",
        "sidebar-accent": "#e8e8e8",
        "sidebar-accent-foreground": "#383a42",
        "sidebar-border": "#dededf",
        "sidebar-ring": "#275fe4"
      }
    }
  }
}
