{
  "name": "Nova",
  "author": "Trevor D. Miller",
  "authorUrl": "https://trevordmiller.com/projects/nova",
  "version": "1.0.0",
  "description": "Ruhiges, pastellig-dunkles Low-Saturation-Schema von Trevor D. Miller, in viele Editoren portiert.",
  "variants": {
    "dark": {
      "mode": "dark",
      "label": "Dark",
      "colors": {
        "background": "#3c4c55",
        "foreground": "#c5d4dd",
        "card": "#556873",
        "card_foreground": "#c5d4dd",
        "popover": "#556873",
        "popover_foreground": "#c5d4dd",
        "primary": "#83afe5",
        "primary_foreground": "#ffffff",
        "secondary": "#556873",
        "secondary_foreground": "#c5d4dd",
        "muted": "#556873",
        "muted_foreground": "#899ba6",
        "accent": "#9a93e1",
        "accent_foreground": "#ffffff",
        "destructive": "#83afe5",
        "destructive_foreground": "#ffffff",
        "border": "#52626b",
        "input": "#52626b",
        "ring": "#83afe5",
        "sidebar.background": "#36444c",
        "toolbar.background": "#556873",
        "title_bar.background": "#556873",
        "status_bar.background": "#556873",
        "border.variant": "#52626b",
        "border.focused": "#83afe5",
        "border.selected": "#83afe5",
        "border.transparent": "#00000000",
        "border.disabled": "#475760",
        "modified": "#83afe5",
        "error": "#83afe5",
        "warning": "#a8ce93",
        "info": "#83afe5",
        "hint": "#899ba6",
        "success": "#7fc1ca",
        "cursor": "#83afe5",
        "selection": "#83afe520",
        "terminal.background": "#3c4c55",
        "terminal.foreground": "#c5d4dd",
        "terminal.bright_foreground": "#ffffff",
        "terminal.dim_foreground": "#899ba6",
        "terminal.ansi.background": "#3c4c55",
        "terminal.ansi.black": "#556873",
        "terminal.ansi.red": "#83afe5",
        "terminal.ansi.green": "#7fc1ca",
        "terminal.ansi.yellow": "#a8ce93",
        "terminal.ansi.blue": "#83afe5",
        "terminal.ansi.magenta": "#9a93e1",
        "terminal.ansi.cyan": "#f2c38f",
        "terminal.ansi.white": "#c5d4dd",
        "terminal.ansi.bright_black": "#899ba6",
        "terminal.ansi.bright_red": "#bed5f1",
        "terminal.ansi.bright_green": "#b1d9df",
        "terminal.ansi.bright_yellow": "#d0e4c4",
        "terminal.ansi.bright_blue": "#bed5f1",
        "terminal.ansi.bright_magenta": "#cecbf1",
        "terminal.ansi.bright_cyan": "#f9e5cf",
        "terminal.ansi.bright_white": "#f5f8f9",
        "terminal.ansi.dim_black": "#3f4d56",
        "terminal.ansi.dim_red": "#2f79d3",
        "terminal.ansi.dim_green": "#4295a1",
        "terminal.ansi.dim_yellow": "#70ad4e",
        "terminal.ansi.dim_blue": "#2f79d3",
        "terminal.ansi.dim_magenta": "#4f43cb",
        "terminal.ansi.dim_cyan": "#e79234",
        "terminal.ansi.dim_white": "#9eb7c6",
        "sidebar-foreground": "#c5d4dd",
        "sidebar-primary": "#83afe5",
        "sidebar-primary-foreground": "#ffffff",
        "sidebar-accent": "#556873",
        "sidebar-accent-foreground": "#c5d4dd",
        "sidebar-border": "#52626b",
        "sidebar-ring": "#83afe5"
      }
    },
    "light": {
      "mode": "light",
      "label": "Light",
      "colors": {
        "background": "#eef3f4",
        "foreground": "#2c3a41",
        "card": "#dde7e9",
        "card_foreground": "#2c3a41",
        "popover": "#dde7e9",
        "popover_foreground": "#2c3a41",
        "primary": "#6199de",
        "primary_foreground": "#ffffff",
        "secondary": "#dde7e9",
        "secondary_foreground": "#2c3a41",
        "muted": "#dde7e9",
        "muted_foreground": "#5c7078",
        "accent": "#7c73d8",
        "accent_foreground": "#ffffff",
        "destructive": "#6199de",
        "destructive_foreground": "#ffffff",
        "border": "#d3d9db",
        "input": "#d3d9db",
        "ring": "#6199de",
        "sidebar.background": "#e8eff0",
        "toolbar.background": "#dde7e9",
        "title_bar.background": "#dde7e9",
        "status_bar.background": "#dde7e9",
        "border.variant": "#d3d9db",
        "border.focused": "#6199de",
        "border.selected": "#6199de",
        "border.transparent": "#00000000",
        "border.disabled": "#e0e6e8",
        "modified": "#6199de",
        "error": "#6199de",
        "warning": "#91c177",
        "info": "#6199de",
        "hint": "#5c7078",
        "success": "#62b3be",
        "cursor": "#6199de",
        "selection": "#6199de20",
        "terminal.background": "#eef3f4",
        "terminal.foreground": "#2c3a41",
        "terminal.bright_foreground": "#000000",
        "terminal.dim_foreground": "#5c7078",
        "terminal.ansi.background": "#eef3f4",
        "terminal.ansi.black": "#2c3a41",
        "terminal.ansi.red": "#6199de",
        "terminal.ansi.green": "#62b3be",
        "terminal.ansi.yellow": "#91c177",
        "terminal.ansi.blue": "#6199de",
        "terminal.ansi.magenta": "#7c73d8",
        "terminal.ansi.cyan": "#eeaf6a",
        "terminal.ansi.white": "#5c7078",
        "terminal.ansi.bright_black": "#171f23",
        "terminal.ansi.bright_red": "#9cbfea",
        "terminal.ansi.bright_green": "#94cbd3",
        "terminal.ansi.bright_yellow": "#b9d7a8",
        "terminal.ansi.bright_blue": "#9cbfea",
        "terminal.ansi.bright_magenta": "#b0abe8",
        "terminal.ansi.bright_cyan": "#f5d1aa",
        "terminal.ansi.bright_white": "#000000",
        "terminal.ansi.dim_black": "#171f23",
        "terminal.ansi.dim_red": "#2565b4",
        "terminal.ansi.dim_green": "#367a84",
        "terminal.ansi.dim_yellow": "#5d9042",
        "terminal.ansi.dim_blue": "#2565b4",
        "terminal.ansi.dim_magenta": "#3d32b3",
        "terminal.ansi.dim_cyan": "#d97d19",
        "terminal.ansi.dim_white": "#798f98",
        "sidebar-foreground": "#2c3a41",
        "sidebar-primary": "#6199de",
        "sidebar-primary-foreground": "#ffffff",
        "sidebar-accent": "#dde7e9",
        "sidebar-accent-foreground": "#2c3a41",
        "sidebar-border": "#d3d9db",
        "sidebar-ring": "#6199de"
      }
    }
  }
}
