{
  "name": "VSCode Modern",
  "author": "kcamcam",
  "authorUrl": "",
  "version": "1.0.0",
  "description": "Modern theme inspired by Visual Studio Code",
  "variants": {
    "dark": {
      "mode": "dark",
      "label": "Dark",
      "colors": {
        "background": "#1f1f1f",
        "foreground": "#cccccc",
        "card": "#202020",
        "card_foreground": "#cccccc",
        "popover": "#202020",
        "popover_foreground": "#cccccc",
        "primary": "#0078d4",
        "primary_foreground": "#ffffff",
        "secondary": "#2a2d2e",
        "secondary_foreground": "#cccccc",
        "muted": "#2a2d2e",
        "muted_foreground": "#9d9d9d",
        "accent": "#569cd6",
        "accent_foreground": "#1f1f1f",
        "destructive": "#f14c4c",
        "destructive_foreground": "#ffffff",
        "border": "#2b2b2b",
        "input": "#2b2b2b",
        "ring": "#0078d4",
        "sidebar.background": "#181818",
        "toolbar.background": "#202020",
        "title_bar.background": "#202020",
        "status_bar.background": "#202020",
        "border.variant": "#2b2b2b",
        "border.focused": "#0078d4",
        "border.selected": "#0078d4",
        "border.transparent": "#00000000",
        "border.disabled": "#1b1b1b",
        "modified": "#2472c8",
        "error": "#f14c4c",
        "warning": "#e5e510",
        "info": "#2472c8",
        "hint": "#9d9d9d",
        "success": "#0dbc79",
        "cursor": "#0078d4",
        "selection": "#0078d420",
        "terminal.background": "#181818",
        "terminal.foreground": "#cccccc",
        "terminal.bright_foreground": "#ffffff",
        "terminal.dim_foreground": "#9d9d9d",
        "terminal.ansi.background": "#181818",
        "terminal.ansi.black": "#000000",
        "terminal.ansi.red": "#cd3131",
        "terminal.ansi.green": "#0dbc79",
        "terminal.ansi.yellow": "#e5e510",
        "terminal.ansi.blue": "#2472c8",
        "terminal.ansi.magenta": "#bc3fbc",
        "terminal.ansi.cyan": "#11a8cd",
        "terminal.ansi.white": "#e5e5e5",
        "terminal.ansi.bright_black": "#666666",
        "terminal.ansi.bright_red": "#f14c4c",
        "terminal.ansi.bright_green": "#23d18b",
        "terminal.ansi.bright_yellow": "#f5f543",
        "terminal.ansi.bright_blue": "#3b8eea",
        "terminal.ansi.bright_magenta": "#d670d6",
        "terminal.ansi.bright_cyan": "#29b8db",
        "terminal.ansi.bright_white": "#e5e5e5",
        "terminal.ansi.dim_black": "#000000",
        "terminal.ansi.dim_red": "#992424",
        "terminal.ansi.dim_green": "#098d5a",
        "terminal.ansi.dim_yellow": "#abab0c",
        "terminal.ansi.dim_blue": "#1b5596",
        "terminal.ansi.dim_magenta": "#8d2f8d",
        "terminal.ansi.dim_cyan": "#0c7e99",
        "terminal.ansi.dim_white": "#ababab",
        "sidebar-foreground": "#cccccc",
        "sidebar-primary": "#0078d4",
        "sidebar-primary-foreground": "#ffffff",
        "sidebar-accent": "#2a2d2e",
        "sidebar-accent-foreground": "#cccccc",
        "sidebar-border": "#2b2b2b",
        "sidebar-ring": "#0078d4"
      }
    },
    "light": {
      "mode": "light",
      "label": "Light",
      "colors": {
        "background": "#ffffff",
        "foreground": "#3b3b3b",
        "card": "#f8f8f8",
        "card_foreground": "#3b3b3b",
        "popover": "#ffffff",
        "popover_foreground": "#3b3b3b",
        "primary": "#005fb8",
        "primary_foreground": "#ffffff",
        "secondary": "#f0f0f0",
        "secondary_foreground": "#3b3b3b",
        "muted": "#f0f0f0",
        "muted_foreground": "#6b6b6b",
        "accent": "#0078d4",
        "accent_foreground": "#ffffff",
        "destructive": "#cd3131",
        "destructive_foreground": "#ffffff",
        "border": "#e5e5e5",
        "input": "#e5e5e5",
        "ring": "#005fb8",
        "sidebar.background": "#f8f8f8",
        "toolbar.background": "#f8f8f8",
        "title_bar.background": "#f8f8f8",
        "status_bar.background": "#f8f8f8",
        "border.variant": "#e5e5e5",
        "border.focused": "#005fb8",
        "border.selected": "#005fb8",
        "border.transparent": "#00000000",
        "border.disabled": "#e8e8e8",
        "modified": "#1a85ff",
        "error": "#cd3131",
        "warning": "#bf8803",
        "info": "#1a85ff",
        "hint": "#6b6b6b",
        "success": "#487e02",
        "cursor": "#005fb8",
        "selection": "#005fb820",
        "terminal.background": "#ffffff",
        "terminal.foreground": "#3b3b3b",
        "terminal.bright_foreground": "#000000",
        "terminal.dim_foreground": "#6b6b6b",
        "terminal.ansi.background": "#ffffff",
        "terminal.ansi.black": "#000000",
        "terminal.ansi.red": "#cd3131",
        "terminal.ansi.green": "#00bc00",
        "terminal.ansi.yellow": "#949800",
        "terminal.ansi.blue": "#0451a5",
        "terminal.ansi.magenta": "#bc05bc",
        "terminal.ansi.cyan": "#0598bc",
        "terminal.ansi.white": "#555555",
        "terminal.ansi.bright_black": "#666666",
        "terminal.ansi.bright_red": "#cd3131",
        "terminal.ansi.bright_green": "#14ce14",
        "terminal.ansi.bright_yellow": "#b5ba00",
        "terminal.ansi.bright_blue": "#0451a5",
        "terminal.ansi.bright_magenta": "#bc05bc",
        "terminal.ansi.bright_cyan": "#0598bc",
        "terminal.ansi.bright_white": "#a5a5a5",
        "terminal.ansi.dim_black": "#e5e5e5",
        "terminal.ansi.dim_red": "#e69696",
        "terminal.ansi.dim_green": "#96e096",
        "terminal.ansi.dim_yellow": "#c7c980",
        "terminal.ansi.dim_blue": "#82a8d2",
        "terminal.ansi.dim_magenta": "#de82de",
        "terminal.ansi.dim_cyan": "#82c1d2",
        "terminal.ansi.dim_white": "#cccccc",
        "sidebar-foreground": "#3b3b3b",
        "sidebar-primary": "#005fb8",
        "sidebar-primary-foreground": "#ffffff",
        "sidebar-accent": "#f0f0f0",
        "sidebar-accent-foreground": "#3b3b3b",
        "sidebar-border": "#e5e5e5",
        "sidebar-ring": "#005fb8"
      }
    }
  }
}
