{
  "name": "Everblush",
  "author": "Everblush",
  "authorUrl": "https://github.com/Everblush/everblush",
  "version": "1.0.0",
  "description": "Sanftes, warmes Pastell-Dark-Theme mit wachsender Beliebtheit als Terminal- und Editor-Port.",
  "variants": {
    "dark": {
      "mode": "dark",
      "label": "Dark",
      "colors": {
        "background": "#141b1e",
        "foreground": "#bdc3c2",
        "card": "#12191c",
        "card_foreground": "#bdc3c2",
        "popover": "#12191c",
        "popover_foreground": "#bdc3c2",
        "primary": "#67b0e8",
        "primary_foreground": "#ffffff",
        "secondary": "#12191c",
        "secondary_foreground": "#bdc3c2",
        "muted": "#12191c",
        "muted_foreground": "#bdc3c2",
        "accent": "#89DFD1",
        "accent_foreground": "#101014",
        "destructive": "#67b0e8",
        "destructive_foreground": "#ffffff",
        "border": "#2f3638",
        "input": "#2f3638",
        "ring": "#67b0e8",
        "sidebar.background": "#0e1315",
        "toolbar.background": "#12191c",
        "title_bar.background": "#12191c",
        "status_bar.background": "#12191c",
        "border.variant": "#2f3638",
        "border.focused": "#67b0e8",
        "border.selected": "#67b0e8",
        "border.transparent": "#00000000",
        "border.disabled": "#22282b",
        "modified": "#67b0e8",
        "error": "#67b0e8",
        "warning": "#fede5d",
        "info": "#67b0e8",
        "hint": "#bdc3c2",
        "success": "#8ccf7e",
        "cursor": "#67b0e8",
        "selection": "#67b0e820",
        "terminal.background": "#141b1e",
        "terminal.foreground": "#bdc3c2",
        "terminal.bright_foreground": "#ffffff",
        "terminal.dim_foreground": "#bdc3c2",
        "terminal.ansi.background": "#141b1e",
        "terminal.ansi.black": "#22292B",
        "terminal.ansi.red": "#67b0e8",
        "terminal.ansi.green": "#8ccf7e",
        "terminal.ansi.yellow": "#fede5d",
        "terminal.ansi.blue": "#67b0e8",
        "terminal.ansi.magenta": "#67b0e8",
        "terminal.ansi.cyan": "#89DFD1",
        "terminal.ansi.white": "#bdc3c2",
        "terminal.ansi.bright_black": "#22292B",
        "terminal.ansi.bright_red": "#e57474",
        "terminal.ansi.bright_green": "#8ccf7e",
        "terminal.ansi.bright_yellow": "#fede5d",
        "terminal.ansi.bright_blue": "#67b0e8",
        "terminal.ansi.bright_magenta": "#67b0e8",
        "terminal.ansi.bright_cyan": "#89DFD1",
        "terminal.ansi.bright_white": "#ffffff",
        "terminal.ansi.dim_black": "#0b0e0f",
        "terminal.ansi.dim_red": "#1f80ca",
        "terminal.ansi.dim_green": "#51a83f",
        "terminal.ansi.dim_yellow": "#f3c302",
        "terminal.ansi.dim_blue": "#1f80ca",
        "terminal.ansi.dim_magenta": "#1f80ca",
        "terminal.ansi.dim_cyan": "#39c9b2",
        "terminal.ansi.dim_white": "#9da6a4",
        "sidebar-foreground": "#bdc3c2",
        "sidebar-primary": "#67b0e8",
        "sidebar-primary-foreground": "#ffffff",
        "sidebar-accent": "#12191c",
        "sidebar-accent-foreground": "#bdc3c2",
        "sidebar-border": "#2f3638",
        "sidebar-ring": "#67b0e8"
      }
    },
    "light": {
      "mode": "light",
      "label": "Light",
      "colors": {
        "background": "#f2f0e6",
        "foreground": "#232a2c",
        "card": "#e6e2d2",
        "card_foreground": "#232a2c",
        "popover": "#e6e2d2",
        "popover_foreground": "#232a2c",
        "primary": "#51a4e5",
        "primary_foreground": "#ffffff",
        "secondary": "#e6e2d2",
        "secondary_foreground": "#232a2c",
        "muted": "#e6e2d2",
        "muted_foreground": "#5c6b6e",
        "accent": "#61d4c1",
        "accent_foreground": "#101014",
        "destructive": "#3b99e1",
        "destructive_foreground": "#ffffff",
        "border": "#d5d4cc",
        "input": "#d5d4cc",
        "ring": "#51a4e5",
        "sidebar.background": "#efecdf",
        "toolbar.background": "#e6e2d2",
        "title_bar.background": "#e6e2d2",
        "status_bar.background": "#e6e2d2",
        "border.variant": "#d5d4cc",
        "border.focused": "#51a4e5",
        "border.selected": "#51a4e5",
        "border.transparent": "#00000000",
        "border.disabled": "#e4e2d9",
        "modified": "#51a4e5",
        "error": "#3b99e1",
        "warning": "#fed42a",
        "info": "#51a4e5",
        "hint": "#5c6b6e",
        "success": "#6bc159",
        "cursor": "#51a4e5",
        "selection": "#51a4e520",
        "terminal.background": "#f2f0e6",
        "terminal.foreground": "#232a2c",
        "terminal.bright_foreground": "#000000",
        "terminal.dim_foreground": "#5c6b6e",
        "terminal.ansi.background": "#f2f0e6",
        "terminal.ansi.black": "#232a2c",
        "terminal.ansi.red": "#3b99e1",
        "terminal.ansi.green": "#6bc159",
        "terminal.ansi.yellow": "#fed42a",
        "terminal.ansi.blue": "#3b99e1",
        "terminal.ansi.magenta": "#3b99e1",
        "terminal.ansi.cyan": "#61d4c1",
        "terminal.ansi.white": "#5c6b6e",
        "terminal.ansi.bright_black": "#0c0f10",
        "terminal.ansi.bright_red": "#79b9ea",
        "terminal.ansi.bright_green": "#99d48d",
        "terminal.ansi.bright_yellow": "#fee271",
        "terminal.ansi.bright_blue": "#79b9ea",
        "terminal.ansi.bright_magenta": "#79b9ea",
        "terminal.ansi.bright_cyan": "#99e3d7",
        "terminal.ansi.bright_white": "#000000",
        "terminal.ansi.dim_black": "#0c0f10",
        "terminal.ansi.dim_red": "#18649e",
        "terminal.ansi.dim_green": "#3f8331",
        "terminal.ansi.dim_yellow": "#c19b01",
        "terminal.ansi.dim_blue": "#18649e",
        "terminal.ansi.dim_magenta": "#18649e",
        "terminal.ansi.dim_cyan": "#2ca38f",
        "terminal.ansi.dim_white": "#798b8f",
        "sidebar-foreground": "#232a2c",
        "sidebar-primary": "#51a4e5",
        "sidebar-primary-foreground": "#ffffff",
        "sidebar-accent": "#e6e2d2",
        "sidebar-accent-foreground": "#232a2c",
        "sidebar-border": "#d5d4cc",
        "sidebar-ring": "#51a4e5"
      }
    }
  }
}
