{
  "name": "Horizon",
  "author": "Michaël Ball",
  "authorUrl": "https://github.com/michael-ball/horizon-theme",
  "version": "1.0.0",
  "description": "Warmes Dark-Theme mit Rosa/Orange-Akzenten von Michaël Ball, inklusive offizieller „Horizon Bright“-Lichtvariante.",
  "variants": {
    "dark": {
      "mode": "dark",
      "label": "Dark",
      "colors": {
        "background": "#1c1e26",
        "foreground": "#cbced0",
        "card": "#232530",
        "card_foreground": "#cbced0",
        "popover": "#232530",
        "popover_foreground": "#cbced0",
        "primary": "#df5273",
        "primary_foreground": "#ffffff",
        "secondary": "#232530",
        "secondary_foreground": "#cbced0",
        "muted": "#232530",
        "muted_foreground": "#9da0a2",
        "accent": "#b072d1",
        "accent_foreground": "#ffffff",
        "destructive": "#e93c58",
        "destructive_foreground": "#ffffff",
        "border": "#383a41",
        "input": "#383a41",
        "ring": "#df5273",
        "sidebar.background": "#16171d",
        "toolbar.background": "#232530",
        "title_bar.background": "#232530",
        "status_bar.background": "#232530",
        "border.variant": "#383a41",
        "border.focused": "#df5273",
        "border.selected": "#df5273",
        "border.transparent": "#00000000",
        "border.disabled": "#2a2c34",
        "modified": "#df5273",
        "error": "#e93c58",
        "warning": "#efb993",
        "info": "#df5273",
        "hint": "#9da0a2",
        "success": "#efaf8e",
        "cursor": "#df5273",
        "selection": "#df527320",
        "terminal.background": "#1c1e26",
        "terminal.foreground": "#cbced0",
        "terminal.bright_foreground": "#ffffff",
        "terminal.dim_foreground": "#9da0a2",
        "terminal.ansi.background": "#1c1e26",
        "terminal.ansi.black": "#232530",
        "terminal.ansi.red": "#e93c58",
        "terminal.ansi.green": "#efaf8e",
        "terminal.ansi.yellow": "#efb993",
        "terminal.ansi.blue": "#df5273",
        "terminal.ansi.magenta": "#b072d1",
        "terminal.ansi.cyan": "#24a8b4",
        "terminal.ansi.white": "#cbced0",
        "terminal.ansi.bright_black": "#6f6f70",
        "terminal.ansi.bright_red": "#f07c8f",
        "terminal.ansi.bright_green": "#f8dbcd",
        "terminal.ansi.bright_yellow": "#f8e1d1",
        "terminal.ansi.bright_blue": "#ea8ea4",
        "terminal.ansi.bright_magenta": "#cea8e3",
        "terminal.ansi.bright_cyan": "#46ceda",
        "terminal.ansi.bright_white": "#e3e6ee",
        "terminal.ansi.dim_black": "#0d0e13",
        "terminal.ansi.dim_red": "#ac132c",
        "terminal.ansi.dim_green": "#e27035",
        "terminal.ansi.dim_yellow": "#e27f3a",
        "terminal.ansi.dim_blue": "#ab2040",
        "terminal.ansi.dim_magenta": "#8036a7",
        "terminal.ansi.dim_cyan": "#13595f",
        "terminal.ansi.dim_white": "#abb0b3",
        "sidebar-foreground": "#cbced0",
        "sidebar-primary": "#df5273",
        "sidebar-primary-foreground": "#ffffff",
        "sidebar-accent": "#232530",
        "sidebar-accent-foreground": "#cbced0",
        "sidebar-border": "#383a41",
        "sidebar-ring": "#df5273"
      }
    },
    "light": {
      "mode": "light",
      "label": "Light",
      "colors": {
        "background": "#fdf0ed",
        "foreground": "#403c3d",
        "card": "#fadad1",
        "card_foreground": "#403c3d",
        "popover": "#fadad1",
        "popover_foreground": "#403c3d",
        "primary": "#da103f",
        "primary_foreground": "#ffffff",
        "secondary": "#fadad1",
        "secondary_foreground": "#403c3d",
        "muted": "#fadad1",
        "muted_foreground": "#948c8a",
        "accent": "#1d8991",
        "accent_foreground": "#ffffff",
        "destructive": "#f7939b",
        "destructive_foreground": "#ffffff",
        "border": "#e3d7d4",
        "input": "#e3d7d4",
        "ring": "#da103f",
        "sidebar.background": "#fce8e4",
        "toolbar.background": "#fadad1",
        "title_bar.background": "#fadad1",
        "status_bar.background": "#fadad1",
        "border.variant": "#e3d7d4",
        "border.focused": "#da103f",
        "border.selected": "#da103f",
        "border.transparent": "#00000000",
        "border.disabled": "#f0e4e0",
        "modified": "#da103f",
        "error": "#f7939b",
        "warning": "#fbe0d9",
        "info": "#da103f",
        "hint": "#948c8a",
        "success": "#94e1b0",
        "cursor": "#da103f",
        "selection": "#da103f20",
        "terminal.background": "#fdf0ed",
        "terminal.foreground": "#403c3d",
        "terminal.bright_foreground": "#000000",
        "terminal.dim_foreground": "#948c8a",
        "terminal.ansi.background": "#fdf0ed",
        "terminal.ansi.black": "#403c3d",
        "terminal.ansi.red": "#f7939b",
        "terminal.ansi.green": "#94e1b0",
        "terminal.ansi.yellow": "#fbe0d9",
        "terminal.ansi.blue": "#da103f",
        "terminal.ansi.magenta": "#1d8991",
        "terminal.ansi.cyan": "#dc3318",
        "terminal.ansi.white": "#fadad1",
        "terminal.ansi.bright_black": "#bdb3b1",
        "terminal.ansi.bright_red": "#fcd5d9",
        "terminal.ansi.bright_green": "#ccf1d9",
        "terminal.ansi.bright_yellow": "#ffffff",
        "terminal.ansi.bright_blue": "#f14069",
        "terminal.ansi.bright_magenta": "#29c1cc",
        "terminal.ansi.bright_cyan": "#ec6550",
        "terminal.ansi.bright_white": "#f3a28c",
        "terminal.ansi.dim_black": "#262324",
        "terminal.ansi.dim_red": "#f03443",
        "terminal.ansi.dim_green": "#44cb75",
        "terminal.ansi.dim_yellow": "#f1957d",
        "terminal.ansi.dim_blue": "#7b0924",
        "terminal.ansi.dim_magenta": "#0c393c",
        "terminal.ansi.dim_cyan": "#801e0e",
        "terminal.ansi.dim_white": "#ffffff",
        "sidebar-foreground": "#403c3d",
        "sidebar-primary": "#da103f",
        "sidebar-primary-foreground": "#ffffff",
        "sidebar-accent": "#fadad1",
        "sidebar-accent-foreground": "#403c3d",
        "sidebar-border": "#e3d7d4",
        "sidebar-ring": "#da103f"
      }
    }
  }
}
