{
  "name": "Catppuccin Mocha",
  "author": "Catppuccin",
  "authorUrl": "https://github.com/catppuccin",
  "version": "1.0.0",
  "description": "Soothing pastel theme — Mocha (dark) paired with Latte (light)",
  "variants": {
    "dark": {
      "mode": "dark",
      "label": "Mocha",
      "colors": {
        "background": "#1e1e2e",
        "foreground": "#cdd6f4",
        "card": "#181825",
        "card_foreground": "#cdd6f4",
        "popover": "#313244",
        "popover_foreground": "#cdd6f4",
        "primary": "#cba6f7",
        "primary_foreground": "#1e1e2e",
        "secondary": "#313244",
        "secondary_foreground": "#cdd6f4",
        "muted": "#313244",
        "muted_foreground": "#bac2de",
        "accent": "#94e2d5",
        "accent_foreground": "#1e1e2e",
        "destructive": "#f38ba8",
        "destructive_foreground": "#ffffff",
        "border": "#45475a",
        "input": "#45475a",
        "ring": "#cba6f7",
        "sidebar.background": "#181825",
        "toolbar.background": "#181825",
        "title_bar.background": "#181825",
        "status_bar.background": "#181825",
        "border.variant": "#45475a",
        "border.focused": "#cba6f7",
        "border.selected": "#cba6f7",
        "border.transparent": "#00000000",
        "border.disabled": "#2c2e3a",
        "modified": "#89b4fa",
        "error": "#f38ba8",
        "warning": "#f9e2af",
        "info": "#89b4fa",
        "hint": "#bac2de",
        "success": "#a6e3a1",
        "cursor": "#cba6f7",
        "selection": "#cba6f720",
        "terminal.background": "#1e1e2e",
        "terminal.foreground": "#cdd6f4",
        "terminal.bright_foreground": "#ffffff",
        "terminal.dim_foreground": "#bac2de",
        "terminal.ansi.background": "#1e1e2e",
        "terminal.ansi.black": "#45475a",
        "terminal.ansi.red": "#f38ba8",
        "terminal.ansi.green": "#a6e3a1",
        "terminal.ansi.yellow": "#f9e2af",
        "terminal.ansi.blue": "#89b4fa",
        "terminal.ansi.magenta": "#f5c2e7",
        "terminal.ansi.cyan": "#94e2d5",
        "terminal.ansi.white": "#a6adc8",
        "terminal.ansi.bright_black": "#585b70",
        "terminal.ansi.bright_red": "#f37799",
        "terminal.ansi.bright_green": "#89d88b",
        "terminal.ansi.bright_yellow": "#ebd391",
        "terminal.ansi.bright_blue": "#74a8fc",
        "terminal.ansi.bright_magenta": "#f2aede",
        "terminal.ansi.bright_cyan": "#6bd7ca",
        "terminal.ansi.bright_white": "#bac2de",
        "terminal.ansi.dim_black": "#333543",
        "terminal.ansi.dim_red": "#b6687e",
        "terminal.ansi.dim_green": "#7caa78",
        "terminal.ansi.dim_yellow": "#baa983",
        "terminal.ansi.dim_blue": "#6687bb",
        "terminal.ansi.dim_magenta": "#b791ad",
        "terminal.ansi.dim_cyan": "#6fa99f",
        "terminal.ansi.dim_white": "#8b91a6",
        "sidebar-foreground": "#cdd6f4",
        "sidebar-primary": "#cba6f7",
        "sidebar-primary-foreground": "#1e1e2e",
        "sidebar-accent": "#313244",
        "sidebar-accent-foreground": "#cdd6f4",
        "sidebar-border": "#45475a",
        "sidebar-ring": "#cba6f7"
      }
    },
    "light": {
      "mode": "light",
      "label": "Latte",
      "colors": {
        "background": "#eff1f5",
        "foreground": "#4c4f69",
        "card": "#e6e9ef",
        "card_foreground": "#4c4f69",
        "popover": "#e6e9ef",
        "popover_foreground": "#4c4f69",
        "primary": "#8839ef",
        "primary_foreground": "#eff1f5",
        "secondary": "#dce0e8",
        "secondary_foreground": "#4c4f69",
        "muted": "#dce0e8",
        "muted_foreground": "#8c8fa1",
        "accent": "#209fb5",
        "accent_foreground": "#eff1f5",
        "destructive": "#d20f39",
        "destructive_foreground": "#000000",
        "border": "#ccd0da",
        "input": "#ccd0da",
        "ring": "#8839ef",
        "sidebar.background": "#e6e9ef",
        "toolbar.background": "#e6e9ef",
        "title_bar.background": "#e6e9ef",
        "status_bar.background": "#e6e9ef",
        "border.variant": "#ccd0da",
        "border.focused": "#8839ef",
        "border.selected": "#8839ef",
        "border.transparent": "#00000000",
        "border.disabled": "#84878d",
        "modified": "#1e66f5",
        "error": "#d20f39",
        "warning": "#df8e1d",
        "info": "#1e66f5",
        "hint": "#8c8fa1",
        "success": "#40a02b",
        "cursor": "#8839ef",
        "selection": "#8839ef20",
        "terminal.background": "#eff1f5",
        "terminal.foreground": "#4c4f69",
        "terminal.bright_foreground": "#000000",
        "terminal.dim_foreground": "#8c8fa1",
        "terminal.ansi.background": "#eff1f5",
        "terminal.ansi.black": "#5c5f77",
        "terminal.ansi.red": "#d20f39",
        "terminal.ansi.green": "#40a02b",
        "terminal.ansi.yellow": "#df8e1d",
        "terminal.ansi.blue": "#1e66f5",
        "terminal.ansi.magenta": "#ea76cb",
        "terminal.ansi.cyan": "#179299",
        "terminal.ansi.white": "#acb0be",
        "terminal.ansi.bright_black": "#6c6f85",
        "terminal.ansi.bright_red": "#de293e",
        "terminal.ansi.bright_green": "#49af3d",
        "terminal.ansi.bright_yellow": "#eea02d",
        "terminal.ansi.bright_blue": "#456eff",
        "terminal.ansi.bright_magenta": "#fe85d8",
        "terminal.ansi.bright_cyan": "#2d9fa8",
        "terminal.ansi.bright_white": "#bcc0cc",
        "terminal.ansi.dim_black": "#454759",
        "terminal.ansi.dim_red": "#9d0b2a",
        "terminal.ansi.dim_green": "#307820",
        "terminal.ansi.dim_yellow": "#a76a15",
        "terminal.ansi.dim_blue": "#164cb7",
        "terminal.ansi.dim_magenta": "#af5898",
        "terminal.ansi.dim_cyan": "#116d72",
        "terminal.ansi.dim_white": "#81848e",
        "sidebar-foreground": "#4c4f69",
        "sidebar-primary": "#8839ef",
        "sidebar-primary-foreground": "#eff1f5",
        "sidebar-accent": "#dce0e8",
        "sidebar-accent-foreground": "#4c4f69",
        "sidebar-border": "#ccd0da",
        "sidebar-ring": "#8839ef"
      }
    }
  }
}
