{
  "name": "Firewatch",
  "author": "Sebastian Szturo",
  "authorUrl": "https://github.com/SebastianSzturo/firewatch-syntax",
  "version": "1.0.0",
  "description": "Vom Videospiel „Firewatch“ inspiriertes warmes Orange/Rot-Schema, ursprünglich ein Atom-Syntax-Theme, breit portiert.",
  "variants": {
    "dark": {
      "mode": "dark",
      "label": "Dark",
      "colors": {
        "background": "#1e2027",
        "foreground": "#9ba2b2",
        "card": "#282b33",
        "card_foreground": "#9ba2b2",
        "popover": "#282b33",
        "popover_foreground": "#9ba2b2",
        "primary": "#4d89c4",
        "primary_foreground": "#ffffff",
        "secondary": "#282b33",
        "secondary_foreground": "#9ba2b2",
        "muted": "#282b33",
        "muted_foreground": "#585f6d",
        "accent": "#d55119",
        "accent_foreground": "#ffffff",
        "destructive": "#d95360",
        "destructive_foreground": "#ffffff",
        "border": "#32353d",
        "input": "#32353d",
        "ring": "#4d89c4",
        "sidebar.background": "#17191e",
        "toolbar.background": "#282b33",
        "title_bar.background": "#282b33",
        "status_bar.background": "#282b33",
        "border.variant": "#32353d",
        "border.focused": "#4d89c4",
        "border.selected": "#4d89c4",
        "border.transparent": "#00000000",
        "border.disabled": "#282a32",
        "modified": "#4d89c4",
        "error": "#d95360",
        "warning": "#dfb563",
        "info": "#4d89c4",
        "hint": "#585f6d",
        "success": "#5ab977",
        "cursor": "#4d89c4",
        "selection": "#4d89c420",
        "terminal.background": "#1e2027",
        "terminal.foreground": "#9ba2b2",
        "terminal.bright_foreground": "#ffffff",
        "terminal.dim_foreground": "#585f6d",
        "terminal.ansi.background": "#1e2027",
        "terminal.ansi.black": "#585f6d",
        "terminal.ansi.red": "#d95360",
        "terminal.ansi.green": "#5ab977",
        "terminal.ansi.yellow": "#dfb563",
        "terminal.ansi.blue": "#4d89c4",
        "terminal.ansi.magenta": "#d55119",
        "terminal.ansi.cyan": "#44a8b6",
        "terminal.ansi.white": "#e6e5ff",
        "terminal.ansi.bright_black": "#585f6d",
        "terminal.ansi.bright_red": "#d95360",
        "terminal.ansi.bright_green": "#5ab977",
        "terminal.ansi.bright_yellow": "#dfb563",
        "terminal.ansi.bright_blue": "#4c89c5",
        "terminal.ansi.bright_magenta": "#d55119",
        "terminal.ansi.bright_cyan": "#44a8b6",
        "terminal.ansi.bright_white": "#e6e5ff",
        "terminal.ansi.dim_black": "#414651",
        "terminal.ansi.dim_red": "#a22430",
        "terminal.ansi.dim_green": "#347949",
        "terminal.ansi.dim_yellow": "#b78525",
        "terminal.ansi.dim_blue": "#2b5680",
        "terminal.ansi.dim_magenta": "#7a2e0e",
        "terminal.ansi.dim_cyan": "#28636c",
        "terminal.ansi.dim_white": "#aba8ff",
        "sidebar-foreground": "#9ba2b2",
        "sidebar-primary": "#4d89c4",
        "sidebar-primary-foreground": "#ffffff",
        "sidebar-accent": "#282b33",
        "sidebar-accent-foreground": "#9ba2b2",
        "sidebar-border": "#32353d",
        "sidebar-ring": "#4d89c4"
      }
    },
    "light": {
      "mode": "light",
      "label": "Light",
      "colors": {
        "background": "#f5f1e8",
        "foreground": "#33302b",
        "card": "#ebe4d3",
        "card_foreground": "#33302b",
        "popover": "#ebe4d3",
        "popover_foreground": "#33302b",
        "primary": "#3a75ae",
        "primary_foreground": "#ffffff",
        "secondary": "#ebe4d3",
        "secondary_foreground": "#33302b",
        "muted": "#ebe4d3",
        "muted_foreground": "#7a7266",
        "accent": "#be4816",
        "accent_foreground": "#ffffff",
        "destructive": "#d23241",
        "destructive_foreground": "#ffffff",
        "border": "#dad6ce",
        "input": "#dad6ce",
        "ring": "#3a75ae",
        "sidebar.background": "#f2ede1",
        "toolbar.background": "#ebe4d3",
        "title_bar.background": "#ebe4d3",
        "status_bar.background": "#ebe4d3",
        "border.variant": "#dad6ce",
        "border.focused": "#3a75ae",
        "border.selected": "#3a75ae",
        "border.transparent": "#00000000",
        "border.disabled": "#e8e4db",
        "modified": "#3a75ae",
        "error": "#d23241",
        "warning": "#d8a541",
        "info": "#3a75ae",
        "hint": "#7a7266",
        "success": "#46a463",
        "cursor": "#3a75ae",
        "selection": "#3a75ae20",
        "terminal.background": "#f5f1e8",
        "terminal.foreground": "#33302b",
        "terminal.bright_foreground": "#000000",
        "terminal.dim_foreground": "#7a7266",
        "terminal.ansi.background": "#f5f1e8",
        "terminal.ansi.black": "#33302b",
        "terminal.ansi.red": "#d23241",
        "terminal.ansi.green": "#46a463",
        "terminal.ansi.yellow": "#d8a541",
        "terminal.ansi.blue": "#3a75ae",
        "terminal.ansi.magenta": "#b04315",
        "terminal.ansi.cyan": "#398d98",
        "terminal.ansi.white": "#7a7266",
        "terminal.ansi.bright_black": "#171614",
        "terminal.ansi.bright_red": "#df6d77",
        "terminal.ansi.bright_green": "#70c289",
        "terminal.ansi.bright_yellow": "#e4c17c",
        "terminal.ansi.bright_blue": "#6499cb",
        "terminal.ansi.bright_magenta": "#e56027",
        "terminal.ansi.bright_cyan": "#58b4c0",
        "terminal.ansi.bright_white": "#000000",
        "terminal.ansi.dim_black": "#171614",
        "terminal.ansi.dim_red": "#821c26",
        "terminal.ansi.dim_green": "#275d38",
        "terminal.ansi.dim_yellow": "#956d1e",
        "terminal.ansi.dim_blue": "#204262",
        "terminal.ansi.dim_magenta": "#55200a",
        "terminal.ansi.dim_cyan": "#1d484e",
        "terminal.ansi.dim_white": "#999185",
        "sidebar-foreground": "#33302b",
        "sidebar-primary": "#3a75ae",
        "sidebar-primary-foreground": "#ffffff",
        "sidebar-accent": "#ebe4d3",
        "sidebar-accent-foreground": "#33302b",
        "sidebar-border": "#dad6ce",
        "sidebar-ring": "#3a75ae"
      }
    }
  }
}
