{
  "name": "Sonokai",
  "author": "Sainnhe Park",
  "authorUrl": "https://github.com/sainnhe/sonokai",
  "version": "1.0.0",
  "description": "Sehr sattes, Monokai-Pro-inspiriertes Schema von sainnhe mit mehreren Kontrast-Presets.",
  "variants": {
    "dark": {
      "mode": "dark",
      "label": "Dark",
      "colors": {
        "background": "#2c2e34",
        "foreground": "#e2e2e3",
        "card": "#33353f",
        "card_foreground": "#e2e2e3",
        "popover": "#33353f",
        "popover_foreground": "#e2e2e3",
        "primary": "#76cce0",
        "primary_foreground": "#101014",
        "secondary": "#33353f",
        "secondary_foreground": "#e2e2e3",
        "muted": "#33353f",
        "muted_foreground": "#7f8490",
        "accent": "#b39df3",
        "accent_foreground": "#ffffff",
        "destructive": "#fc5d7c",
        "destructive_foreground": "#ffffff",
        "border": "#494b50",
        "input": "#494b50",
        "ring": "#76cce0",
        "sidebar.background": "#25272c",
        "toolbar.background": "#33353f",
        "title_bar.background": "#33353f",
        "status_bar.background": "#33353f",
        "border.variant": "#494b50",
        "border.focused": "#76cce0",
        "border.selected": "#76cce0",
        "border.transparent": "#00000000",
        "border.disabled": "#3a3c42",
        "modified": "#76cce0",
        "error": "#fc5d7c",
        "warning": "#e7c664",
        "info": "#76cce0",
        "hint": "#7f8490",
        "success": "#9ed072",
        "cursor": "#76cce0",
        "selection": "#76cce020",
        "terminal.background": "#2c2e34",
        "terminal.foreground": "#e2e2e3",
        "terminal.bright_foreground": "#ffffff",
        "terminal.dim_foreground": "#7f8490",
        "terminal.ansi.background": "#2c2e34",
        "terminal.ansi.black": "#414550",
        "terminal.ansi.red": "#fc5d7c",
        "terminal.ansi.green": "#9ed072",
        "terminal.ansi.yellow": "#e7c664",
        "terminal.ansi.blue": "#76cce0",
        "terminal.ansi.magenta": "#b39df3",
        "terminal.ansi.cyan": "#f39660",
        "terminal.ansi.white": "#e2e2e3",
        "terminal.ansi.bright_black": "#7f8490",
        "terminal.ansi.bright_red": "#fda3b5",
        "terminal.ansi.bright_green": "#c3e2a8",
        "terminal.ansi.bright_yellow": "#f1dda2",
        "terminal.ansi.bright_blue": "#b0e2ed",
        "terminal.ansi.bright_magenta": "#e4ddfb",
        "terminal.ansi.bright_cyan": "#f8c2a2",
        "terminal.ansi.bright_white": "#ffffff",
        "terminal.ansi.dim_black": "#2a2d34",
        "terminal.ansi.dim_red": "#ef0432",
        "terminal.ansi.dim_green": "#6aa537",
        "terminal.ansi.dim_yellow": "#c69c1f",
        "terminal.ansi.dim_blue": "#2ca7c4",
        "terminal.ansi.dim_magenta": "#6d42e8",
        "terminal.ansi.dim_cyan": "#dc5b11",
        "terminal.ansi.dim_white": "#c3c3c5",
        "sidebar-foreground": "#e2e2e3",
        "sidebar-primary": "#76cce0",
        "sidebar-primary-foreground": "#101014",
        "sidebar-accent": "#33353f",
        "sidebar-accent-foreground": "#e2e2e3",
        "sidebar-border": "#494b50",
        "sidebar-ring": "#76cce0"
      }
    },
    "light": {
      "mode": "light",
      "label": "Light",
      "colors": {
        "background": "#f5f3ea",
        "foreground": "#2c2e34",
        "card": "#e9e5d3",
        "card_foreground": "#2c2e34",
        "popover": "#e9e5d3",
        "popover_foreground": "#2c2e34",
        "primary": "#38b5d2",
        "primary_foreground": "#ffffff",
        "secondary": "#e9e5d3",
        "secondary_foreground": "#2c2e34",
        "muted": "#e9e5d3",
        "muted_foreground": "#6b6f5f",
        "accent": "#9070ed",
        "accent_foreground": "#ffffff",
        "destructive": "#fb2b54",
        "destructive_foreground": "#ffffff",
        "border": "#d9d7d1",
        "input": "#d9d7d1",
        "ring": "#38b5d2",
        "sidebar.background": "#f2efe3",
        "toolbar.background": "#e9e5d3",
        "title_bar.background": "#e9e5d3",
        "status_bar.background": "#e9e5d3",
        "border.variant": "#d9d7d1",
        "border.focused": "#38b5d2",
        "border.selected": "#38b5d2",
        "border.transparent": "#00000000",
        "border.disabled": "#e7e5de",
        "modified": "#38b5d2",
        "error": "#fb2b54",
        "warning": "#e0b638",
        "info": "#38b5d2",
        "hint": "#6b6f5f",
        "success": "#84c34c",
        "cursor": "#38b5d2",
        "selection": "#38b5d220",
        "terminal.background": "#f5f3ea",
        "terminal.foreground": "#2c2e34",
        "terminal.bright_foreground": "#000000",
        "terminal.dim_foreground": "#6b6f5f",
        "terminal.ansi.background": "#f5f3ea",
        "terminal.ansi.black": "#2c2e34",
        "terminal.ansi.red": "#fb2b54",
        "terminal.ansi.green": "#84c34c",
        "terminal.ansi.yellow": "#e0b638",
        "terminal.ansi.blue": "#4cbdd7",
        "terminal.ansi.magenta": "#9070ed",
        "terminal.ansi.cyan": "#ef7731",
        "terminal.ansi.white": "#6b6f5f",
        "terminal.ansi.bright_black": "#151618",
        "terminal.ansi.bright_red": "#fc718d",
        "terminal.ansi.bright_green": "#a9d581",
        "terminal.ansi.bright_yellow": "#eacd76",
        "terminal.ansi.bright_blue": "#86d3e4",
        "terminal.ansi.bright_magenta": "#c1aff5",
        "terminal.ansi.bright_cyan": "#f4a373",
        "terminal.ansi.bright_white": "#000000",
        "terminal.ansi.dim_black": "#151618",
        "terminal.ansi.dim_red": "#bc0428",
        "terminal.ansi.dim_green": "#527f2a",
        "terminal.ansi.dim_yellow": "#9a7a18",
        "terminal.ansi.dim_blue": "#23849a",
        "terminal.ansi.dim_magenta": "#4d1cdb",
        "terminal.ansi.dim_cyan": "#ad480d",
        "terminal.ansi.dim_white": "#8a8f7c",
        "sidebar-foreground": "#2c2e34",
        "sidebar-primary": "#38b5d2",
        "sidebar-primary-foreground": "#ffffff",
        "sidebar-accent": "#e9e5d3",
        "sidebar-accent-foreground": "#2c2e34",
        "sidebar-border": "#d9d7d1",
        "sidebar-ring": "#38b5d2"
      }
    }
  }
}
