{
  "name": "Spacegray",
  "author": "Kris Gunnars / kkga",
  "authorUrl": "https://github.com/kkga/spacegray",
  "version": "1.0.0",
  "description": "Dezentes Grau-Blau-Schema, ursprünglich ein Sublime-Text-Theme, breit in Terminals portiert.",
  "variants": {
    "dark": {
      "mode": "dark",
      "label": "Dark",
      "colors": {
        "background": "#20242d",
        "foreground": "#b3b8c3",
        "card": "#2b2f38",
        "card_foreground": "#b3b8c3",
        "popover": "#2b2f38",
        "popover_foreground": "#b3b8c3",
        "primary": "#7d8fa4",
        "primary_foreground": "#ffffff",
        "secondary": "#2b2f38",
        "secondary_foreground": "#b3b8c3",
        "muted": "#2b2f38",
        "muted_foreground": "#4c4c4c",
        "accent": "#a47996",
        "accent_foreground": "#ffffff",
        "destructive": "#b04b57",
        "destructive_foreground": "#ffffff",
        "border": "#383c45",
        "input": "#383c45",
        "ring": "#7d8fa4",
        "sidebar.background": "#1a1d24",
        "toolbar.background": "#2b2f38",
        "title_bar.background": "#2b2f38",
        "status_bar.background": "#2b2f38",
        "border.variant": "#383c45",
        "border.focused": "#7d8fa4",
        "border.selected": "#7d8fa4",
        "border.transparent": "#00000000",
        "border.disabled": "#2c3039",
        "modified": "#7d8fa4",
        "error": "#b04b57",
        "warning": "#e5c179",
        "info": "#7d8fa4",
        "hint": "#4c4c4c",
        "success": "#87b379",
        "cursor": "#7d8fa4",
        "selection": "#7d8fa420",
        "terminal.background": "#20242d",
        "terminal.foreground": "#b3b8c3",
        "terminal.bright_foreground": "#ffffff",
        "terminal.dim_foreground": "#4c4c4c",
        "terminal.ansi.background": "#20242d",
        "terminal.ansi.black": "#000000",
        "terminal.ansi.red": "#b04b57",
        "terminal.ansi.green": "#87b379",
        "terminal.ansi.yellow": "#e5c179",
        "terminal.ansi.blue": "#7d8fa4",
        "terminal.ansi.magenta": "#a47996",
        "terminal.ansi.cyan": "#85a7a5",
        "terminal.ansi.white": "#b3b8c3",
        "terminal.ansi.bright_black": "#4c4c4c",
        "terminal.ansi.bright_red": "#b04b57",
        "terminal.ansi.bright_green": "#87b379",
        "terminal.ansi.bright_yellow": "#e5c179",
        "terminal.ansi.bright_blue": "#7d8fa4",
        "terminal.ansi.bright_magenta": "#a47996",
        "terminal.ansi.bright_cyan": "#85a7a5",
        "terminal.ansi.bright_white": "#ffffff",
        "terminal.ansi.dim_black": "#000000",
        "terminal.ansi.dim_red": "#682d34",
        "terminal.ansi.dim_green": "#557e48",
        "terminal.ansi.dim_yellow": "#d09828",
        "terminal.ansi.dim_blue": "#4d5c6e",
        "terminal.ansi.dim_magenta": "#6d4a62",
        "terminal.ansi.dim_cyan": "#537371",
        "terminal.ansi.dim_white": "#9198a8",
        "sidebar-foreground": "#b3b8c3",
        "sidebar-primary": "#7d8fa4",
        "sidebar-primary-foreground": "#ffffff",
        "sidebar-accent": "#2b2f38",
        "sidebar-accent-foreground": "#b3b8c3",
        "sidebar-border": "#383c45",
        "sidebar-ring": "#7d8fa4"
      }
    },
    "light": {
      "mode": "light",
      "label": "Light",
      "colors": {
        "background": "#eceef2",
        "foreground": "#20242d",
        "card": "#dde0e6",
        "card_foreground": "#20242d",
        "popover": "#dde0e6",
        "popover_foreground": "#20242d",
        "primary": "#6e829a",
        "primary_foreground": "#ffffff",
        "secondary": "#dde0e6",
        "secondary_foreground": "#20242d",
        "muted": "#dde0e6",
        "muted_foreground": "#5a606e",
        "accent": "#9a6a8a",
        "accent_foreground": "#ffffff",
        "destructive": "#933f49",
        "destructive_foreground": "#ffffff",
        "border": "#cfd2d6",
        "input": "#cfd2d6",
        "ring": "#6e829a",
        "sidebar.background": "#e6e9ee",
        "toolbar.background": "#dde0e6",
        "title_bar.background": "#dde0e6",
        "status_bar.background": "#dde0e6",
        "border.variant": "#cfd2d6",
        "border.focused": "#6e829a",
        "border.selected": "#6e829a",
        "border.transparent": "#00000000",
        "border.disabled": "#dee0e4",
        "modified": "#6e829a",
        "error": "#933f49",
        "warning": "#deb157",
        "info": "#6e829a",
        "hint": "#5a606e",
        "success": "#70a45f",
        "cursor": "#6e829a",
        "selection": "#6e829a20",
        "terminal.background": "#eceef2",
        "terminal.foreground": "#20242d",
        "terminal.bright_foreground": "#000000",
        "terminal.dim_foreground": "#5a606e",
        "terminal.ansi.background": "#eceef2",
        "terminal.ansi.black": "#20242d",
        "terminal.ansi.red": "#933f49",
        "terminal.ansi.green": "#70a45f",
        "terminal.ansi.yellow": "#deb157",
        "terminal.ansi.blue": "#667a92",
        "terminal.ansi.magenta": "#916382",
        "terminal.ansi.cyan": "#6d9694",
        "terminal.ansi.white": "#5a606e",
        "terminal.ansi.bright_black": "#0b0c0f",
        "terminal.ansi.bright_red": "#ba5f6a",
        "terminal.ansi.bright_green": "#99be8d",
        "terminal.ansi.bright_yellow": "#eacd93",
        "terminal.ansi.bright_blue": "#8f9eb1",
        "terminal.ansi.bright_magenta": "#b08ba4",
        "terminal.ansi.bright_cyan": "#97b4b2",
        "terminal.ansi.bright_white": "#000000",
        "terminal.ansi.dim_black": "#0b0c0f",
        "terminal.ansi.dim_red": "#4c2026",
        "terminal.ansi.dim_green": "#446439",
        "terminal.ansi.dim_yellow": "#ad7f22",
        "terminal.ansi.dim_blue": "#3c4856",
        "terminal.ansi.dim_magenta": "#543a4c",
        "terminal.ansi.dim_cyan": "#425b5a",
        "terminal.ansi.dim_white": "#767e8f",
        "sidebar-foreground": "#20242d",
        "sidebar-primary": "#6e829a",
        "sidebar-primary-foreground": "#ffffff",
        "sidebar-accent": "#dde0e6",
        "sidebar-accent-foreground": "#20242d",
        "sidebar-border": "#cfd2d6",
        "sidebar-ring": "#6e829a"
      }
    }
  }
}
