{
  "name": "Catppuccin Frappé",
  "author": "Catppuccin",
  "authorUrl": "https://github.com/catppuccin",
  "version": "1.0.0",
  "description": "Soothing pastel theme — Frappé (dark) paired with Latte (light)",
  "variants": {
    "dark": {
      "mode": "dark",
      "label": "Frappé",
      "colors": {
        "background": "#303446",
        "foreground": "#c6d0f5",
        "card": "#292c3c",
        "card_foreground": "#c6d0f5",
        "popover": "#414559",
        "popover_foreground": "#c6d0f5",
        "primary": "#ca9ee6",
        "primary_foreground": "#303446",
        "secondary": "#414559",
        "secondary_foreground": "#c6d0f5",
        "muted": "#414559",
        "muted_foreground": "#b5bfe2",
        "accent": "#81c8be",
        "accent_foreground": "#303446",
        "destructive": "#e78284",
        "destructive_foreground": "#ffffff",
        "border": "#51576d",
        "input": "#51576d",
        "ring": "#ca9ee6",
        "sidebar.background": "#292c3c",
        "toolbar.background": "#292c3c",
        "title_bar.background": "#292c3c",
        "status_bar.background": "#292c3c",
        "border.variant": "#51576d",
        "border.focused": "#ca9ee6",
        "border.selected": "#ca9ee6",
        "border.transparent": "#00000000",
        "border.disabled": "#343846",
        "modified": "#8caaee",
        "error": "#e78284",
        "warning": "#e5c890",
        "info": "#8caaee",
        "hint": "#b5bfe2",
        "success": "#a6d189",
        "cursor": "#ca9ee6",
        "selection": "#ca9ee620",
        "terminal.background": "#303446",
        "terminal.foreground": "#c6d0f5",
        "terminal.bright_foreground": "#ffffff",
        "terminal.dim_foreground": "#b5bfe2",
        "terminal.ansi.background": "#303446",
        "terminal.ansi.black": "#51576d",
        "terminal.ansi.red": "#e78284",
        "terminal.ansi.green": "#a6d189",
        "terminal.ansi.yellow": "#e5c890",
        "terminal.ansi.blue": "#8caaee",
        "terminal.ansi.magenta": "#f4b8e4",
        "terminal.ansi.cyan": "#81c8be",
        "terminal.ansi.white": "#a5adce",
        "terminal.ansi.bright_black": "#626880",
        "terminal.ansi.bright_red": "#e67172",
        "terminal.ansi.bright_green": "#8ec772",
        "terminal.ansi.bright_yellow": "#d9ba73",
        "terminal.ansi.bright_blue": "#7b9ef0",
        "terminal.ansi.bright_magenta": "#f2a4db",
        "terminal.ansi.bright_cyan": "#5abfb5",
        "terminal.ansi.bright_white": "#b5bfe2",
        "terminal.ansi.dim_black": "#3c4151",
        "terminal.ansi.dim_red": "#ad6163",
        "terminal.ansi.dim_green": "#7c9c66",
        "terminal.ansi.dim_yellow": "#ab966c",
        "terminal.ansi.dim_blue": "#697fb2",
        "terminal.ansi.dim_magenta": "#b78aab",
        "terminal.ansi.dim_cyan": "#60968e",
        "terminal.ansi.dim_white": "#878fa9",
        "sidebar-foreground": "#c6d0f5",
        "sidebar-primary": "#ca9ee6",
        "sidebar-primary-foreground": "#303446",
        "sidebar-accent": "#414559",
        "sidebar-accent-foreground": "#c6d0f5",
        "sidebar-border": "#51576d",
        "sidebar-ring": "#ca9ee6"
      }
    },
    "light": {
      "mode": "light",
      "label": "Latte",
      "colors": {
        "background": "#eff1f5",
        "foreground": "#4c4f69",
        "card": "#e6e9ef",
        "card_foreground": "#4c4f69",
        "popover": "#e6e9ef",
        "popover_foreground": "#4c4f69",
        "primary": "#8839ef",
        "primary_foreground": "#eff1f5",
        "secondary": "#dce0e8",
        "secondary_foreground": "#4c4f69",
        "muted": "#dce0e8",
        "muted_foreground": "#8c8fa1",
        "accent": "#209fb5",
        "accent_foreground": "#eff1f5",
        "destructive": "#d20f39",
        "destructive_foreground": "#000000",
        "border": "#ccd0da",
        "input": "#ccd0da",
        "ring": "#8839ef",
        "sidebar.background": "#e6e9ef",
        "toolbar.background": "#e6e9ef",
        "title_bar.background": "#e6e9ef",
        "status_bar.background": "#e6e9ef",
        "border.variant": "#ccd0da",
        "border.focused": "#8839ef",
        "border.selected": "#8839ef",
        "border.transparent": "#00000000",
        "border.disabled": "#84878d",
        "modified": "#1e66f5",
        "error": "#d20f39",
        "warning": "#df8e1d",
        "info": "#1e66f5",
        "hint": "#8c8fa1",
        "success": "#40a02b",
        "cursor": "#8839ef",
        "selection": "#8839ef20",
        "terminal.background": "#eff1f5",
        "terminal.foreground": "#4c4f69",
        "terminal.bright_foreground": "#000000",
        "terminal.dim_foreground": "#8c8fa1",
        "terminal.ansi.background": "#eff1f5",
        "terminal.ansi.black": "#5c5f77",
        "terminal.ansi.red": "#d20f39",
        "terminal.ansi.green": "#40a02b",
        "terminal.ansi.yellow": "#df8e1d",
        "terminal.ansi.blue": "#1e66f5",
        "terminal.ansi.magenta": "#ea76cb",
        "terminal.ansi.cyan": "#179299",
        "terminal.ansi.white": "#acb0be",
        "terminal.ansi.bright_black": "#6c6f85",
        "terminal.ansi.bright_red": "#de293e",
        "terminal.ansi.bright_green": "#49af3d",
        "terminal.ansi.bright_yellow": "#eea02d",
        "terminal.ansi.bright_blue": "#456eff",
        "terminal.ansi.bright_magenta": "#fe85d8",
        "terminal.ansi.bright_cyan": "#2d9fa8",
        "terminal.ansi.bright_white": "#bcc0cc",
        "terminal.ansi.dim_black": "#454759",
        "terminal.ansi.dim_red": "#9d0b2a",
        "terminal.ansi.dim_green": "#307820",
        "terminal.ansi.dim_yellow": "#a76a15",
        "terminal.ansi.dim_blue": "#164cb7",
        "terminal.ansi.dim_magenta": "#af5898",
        "terminal.ansi.dim_cyan": "#116d72",
        "terminal.ansi.dim_white": "#81848e",
        "sidebar-foreground": "#4c4f69",
        "sidebar-primary": "#8839ef",
        "sidebar-primary-foreground": "#eff1f5",
        "sidebar-accent": "#dce0e8",
        "sidebar-accent-foreground": "#4c4f69",
        "sidebar-border": "#ccd0da",
        "sidebar-ring": "#8839ef"
      }
    }
  }
}
