{
  "name": "Seoul256",
  "author": "Junegunn Choi",
  "authorUrl": "https://github.com/junegunn/seoul256.vim",
  "version": "1.0.0",
  "description": "Von Junegunn Choi entwickeltes koreanisch inspiriertes, sehr kontrastarmes Low-Contrast-Schema.",
  "variants": {
    "dark": {
      "mode": "dark",
      "label": "Dark",
      "colors": {
        "background": "#3a3a3a",
        "foreground": "#d0d0d0",
        "card": "#333333",
        "card_foreground": "#d0d0d0",
        "popover": "#333333",
        "popover_foreground": "#d0d0d0",
        "primary": "#85add4",
        "primary_foreground": "#ffffff",
        "secondary": "#333333",
        "secondary_foreground": "#d0d0d0",
        "muted": "#333333",
        "muted_foreground": "#9e9e9e",
        "accent": "#d7afaf",
        "accent_foreground": "#101014",
        "destructive": "#d68787",
        "destructive_foreground": "#ffffff",
        "border": "#525252",
        "input": "#525252",
        "ring": "#85add4",
        "sidebar.background": "#323232",
        "toolbar.background": "#333333",
        "title_bar.background": "#333333",
        "status_bar.background": "#333333",
        "border.variant": "#525252",
        "border.focused": "#85add4",
        "border.selected": "#85add4",
        "border.transparent": "#00000000",
        "border.disabled": "#464646",
        "modified": "#85add4",
        "error": "#d68787",
        "warning": "#d8af5f",
        "info": "#85add4",
        "hint": "#9e9e9e",
        "success": "#5f865f",
        "cursor": "#85add4",
        "selection": "#85add420",
        "terminal.background": "#3a3a3a",
        "terminal.foreground": "#d0d0d0",
        "terminal.bright_foreground": "#ffffff",
        "terminal.dim_foreground": "#9e9e9e",
        "terminal.ansi.background": "#3a3a3a",
        "terminal.ansi.black": "#4e4e4e",
        "terminal.ansi.red": "#d68787",
        "terminal.ansi.green": "#5f865f",
        "terminal.ansi.yellow": "#d8af5f",
        "terminal.ansi.blue": "#85add4",
        "terminal.ansi.magenta": "#d7afaf",
        "terminal.ansi.cyan": "#87afaf",
        "terminal.ansi.white": "#d0d0d0",
        "terminal.ansi.bright_black": "#626262",
        "terminal.ansi.bright_red": "#d75f87",
        "terminal.ansi.bright_green": "#87af87",
        "terminal.ansi.bright_yellow": "#ffd787",
        "terminal.ansi.bright_blue": "#add4fb",
        "terminal.ansi.bright_magenta": "#ffafaf",
        "terminal.ansi.bright_cyan": "#87d7d7",
        "terminal.ansi.bright_white": "#e4e4e4",
        "terminal.ansi.dim_black": "#353535",
        "terminal.ansi.dim_red": "#b83f3f",
        "terminal.ansi.dim_green": "#354a35",
        "terminal.ansi.dim_yellow": "#a87d29",
        "terminal.ansi.dim_blue": "#3f7ab4",
        "terminal.ansi.dim_magenta": "#b56b6b",
        "terminal.ansi.dim_cyan": "#537d7d",
        "terminal.ansi.dim_white": "#b1b1b1",
        "sidebar-foreground": "#d0d0d0",
        "sidebar-primary": "#85add4",
        "sidebar-primary-foreground": "#ffffff",
        "sidebar-accent": "#333333",
        "sidebar-accent-foreground": "#d0d0d0",
        "sidebar-border": "#525252",
        "sidebar-ring": "#85add4"
      }
    },
    "light": {
      "mode": "light",
      "label": "Light",
      "colors": {
        "background": "#dadada",
        "foreground": "#4e4e4e",
        "card": "#e4e4e4",
        "card_foreground": "#4e4e4e",
        "popover": "#e4e4e4",
        "popover_foreground": "#4e4e4e",
        "primary": "#5f87ae",
        "primary_foreground": "#ffffff",
        "secondary": "#e4e4e4",
        "secondary_foreground": "#4e4e4e",
        "muted": "#e4e4e4",
        "muted_foreground": "#767676",
        "accent": "#875f87",
        "accent_foreground": "#ffffff",
        "destructive": "#af5f5f",
        "destructive_foreground": "#ffffff",
        "border": "#c6c6c6",
        "input": "#c6c6c6",
        "ring": "#5f87ae",
        "sidebar.background": "#d5d5d5",
        "toolbar.background": "#e4e4e4",
        "title_bar.background": "#e4e4e4",
        "status_bar.background": "#e4e4e4",
        "border.variant": "#c6c6c6",
        "border.focused": "#5f87ae",
        "border.selected": "#5f87ae",
        "border.transparent": "#00000000",
        "border.disabled": "#d0d0d0",
        "modified": "#5f87ae",
        "error": "#af5f5f",
        "warning": "#af8760",
        "info": "#5f87ae",
        "hint": "#767676",
        "success": "#5f885f",
        "cursor": "#5f87ae",
        "selection": "#5f87ae20",
        "terminal.background": "#dadada",
        "terminal.foreground": "#4e4e4e",
        "terminal.bright_foreground": "#000000",
        "terminal.dim_foreground": "#767676",
        "terminal.ansi.background": "#dadada",
        "terminal.ansi.black": "#4e4e4e",
        "terminal.ansi.red": "#af5f5f",
        "terminal.ansi.green": "#5f885f",
        "terminal.ansi.yellow": "#af8760",
        "terminal.ansi.blue": "#5f87ae",
        "terminal.ansi.magenta": "#875f87",
        "terminal.ansi.cyan": "#5f8787",
        "terminal.ansi.white": "#e4e4e4",
        "terminal.ansi.bright_black": "#3a3a3a",
        "terminal.ansi.bright_red": "#870100",
        "terminal.ansi.bright_green": "#005f00",
        "terminal.ansi.bright_yellow": "#d8865f",
        "terminal.ansi.bright_blue": "#0087af",
        "terminal.ansi.bright_magenta": "#87025f",
        "terminal.ansi.bright_cyan": "#008787",
        "terminal.ansi.bright_white": "#eeeeee",
        "terminal.ansi.dim_black": "#353535",
        "terminal.ansi.dim_red": "#703838",
        "terminal.ansi.dim_green": "#354c35",
        "terminal.ansi.dim_yellow": "#705439",
        "terminal.ansi.dim_blue": "#38546f",
        "terminal.ansi.dim_magenta": "#4b354b",
        "terminal.ansi.dim_cyan": "#354b4b",
        "terminal.ansi.dim_white": "#ffffff",
        "sidebar-foreground": "#4e4e4e",
        "sidebar-primary": "#5f87ae",
        "sidebar-primary-foreground": "#ffffff",
        "sidebar-accent": "#e4e4e4",
        "sidebar-accent-foreground": "#4e4e4e",
        "sidebar-border": "#c6c6c6",
        "sidebar-ring": "#5f87ae"
      }
    }
  }
}
